,id,submitter,authors,title,comments,journal-ref,doi,report-no,categories,license,abstract,versions,update_date,authors_parsed
1369845,2010.13515,Andrea Asperti,Andrea Asperti and Stefano Dal Bianco,Syllabification of the Divine Comedy,,,,,cs.CL,http://arxiv.org/licenses/nonexclusive-distrib/1.0/,"  We provide a syllabification algorithm for the Divine Comedy using techniques
from probabilistic and constraint programming. We particularly focus on the
synalephe, addressed in terms of the ""propensity"" of a word to take part in a
synalephe with adjacent words. We jointly provide an online vocabulary
containing, for each word, information about its syllabification, the location
of the tonic accent, and the aforementioned synalephe propensity, on the left
and right sides. The algorithm is intrinsically nondeterministic, producing
different possible syllabifications for each verse, with different likelihoods;
metric constraints relative to accents on the 10th, 4th and 6th syllables are
used to further reduce the solution space. The most likely syllabification is
hence returned as output. We believe that this work could be a major milestone
for a lot of different investigations. From the point of view of digital
humanities it opens new perspectives on computer assisted analysis of digital
sources, comprising automated detection of anomalous and problematic cases,
metric clustering of verses and their categorization, or more foundational
investigations addressing e.g. the phonetic roles of consonants and vowels.
From the point of view of text processing and deep learning, information about
syllabification and the location of accents opens a wide range of exciting
perspectives, from the possibility of automatic learning syllabification of
words and verses, to the improvement of generative models, aware of metric
issues, and more respectful of the expected musicality.
","[{'version': 'v1', 'created': 'Mon, 26 Oct 2020 12:14:14 GMT'}]",2020-10-27,"[['Asperti', 'Andrea', ''], ['Bianco', 'Stefano Dal', '']]"
1369874,2010.13544,Zhenzhen Li,"Zhenzhen Li, Jian-Yun Nie, Benyou Wang, Pan Du, Yuhan Zhang, Lixin
  Zou, and Dongsheng Li","Meta-Learning for Neural Relation Classification with Distant
  Supervision","10 pages, 7 figures; corrected one encoding error in CIKM pdf","In Proceedings of CIKM, pp. 815-824. 2020",10.1145/3340531.3412039,,cs.CL,http://arxiv.org/licenses/nonexclusive-distrib/1.0/,"  Distant supervision provides a means to create a large number of weakly
labeled data at low cost for relation classification. However, the resulting
labeled instances are very noisy, containing data with wrong labels. Many
approaches have been proposed to select a subset of reliable instances for
neural model training, but they still suffer from noisy labeling problem or
underutilization of the weakly-labeled data. To better select more reliable
training instances, we introduce a small amount of manually labeled data as
reference to guide the selection process. In this paper, we propose a
meta-learning based approach, which learns to reweight noisy training data
under the guidance of reference data. As the clean reference data is usually
very small, we propose to augment it by dynamically distilling the most
reliable elite instances from the noisy data. Experiments on several datasets
demonstrate that the reference data can effectively guide the selection of
training data, and our augmented approach consistently improves the performance
of relation classification comparing to the existing state-of-the-art methods.
","[{'version': 'v1', 'created': 'Mon, 26 Oct 2020 12:52:28 GMT'}]",2020-10-27,"[['Li', 'Zhenzhen', ''], ['Nie', 'Jian-Yun', ''], ['Wang', 'Benyou', ''], ['Du', 'Pan', ''], ['Zhang', 'Yuhan', ''], ['Zou', 'Lixin', ''], ['Li', 'Dongsheng', '']]"
1369886,2010.13556,Yu Zhang,"Yu Zhang, Xiusi Chen, Yu Meng, Jiawei Han","Hierarchical Metadata-Aware Document Categorization under Weak
  Supervision",9 pages; Accepted to WSDM 2021,,,,cs.CL cs.IR,http://arxiv.org/licenses/nonexclusive-distrib/1.0/,"  Categorizing documents into a given label hierarchy is intuitively appealing
due to the ubiquity of hierarchical topic structures in massive text corpora.
Although related studies have achieved satisfying performance in fully
supervised hierarchical document classification, they usually require massive
human-annotated training data and only utilize text information. However, in
many domains, (1) annotations are quite expensive where very few training
samples can be acquired; (2) documents are accompanied by metadata information.
Hence, this paper studies how to integrate the label hierarchy, metadata, and
text signals for document categorization under weak supervision. We develop
HiMeCat, an embedding-based generative framework for our task. Specifically, we
propose a novel joint representation learning module that allows simultaneous
modeling of category dependencies, metadata information and textual semantics,
and we introduce a data augmentation module that hierarchically synthesizes
training documents to complement the original, small-scale training set. Our
experiments demonstrate a consistent improvement of HiMeCat over competitive
baselines and validate the contribution of our representation learning and data
augmentation modules.
","[{'version': 'v1', 'created': 'Mon, 26 Oct 2020 13:07:56 GMT'}]",2020-10-27,"[['Zhang', 'Yu', ''], ['Chen', 'Xiusi', ''], ['Meng', 'Yu', ''], ['Han', 'Jiawei', '']]"
1369915,2010.13585,Reza Marzban,"Reza Marzban, Christopher John Crick",Interpreting convolutional networks trained on textual data,"9 pages, 6 figures, 5 tables",,,,cs.CL cs.LG,http://arxiv.org/licenses/nonexclusive-distrib/1.0/,"  There have been many advances in the artificial intelligence field due to the
emergence of deep learning. In almost all sub-fields, artificial neural
networks have reached or exceeded human-level performance. However, most of the
models are not interpretable. As a result, it is hard to trust their decisions,
especially in life and death scenarios. In recent years, there has been a
movement toward creating explainable artificial intelligence, but most work to
date has concentrated on image processing models, as it is easier for humans to
perceive visual patterns. There has been little work in other fields like
natural language processing. In this paper, we train a convolutional model on
textual data and analyze the global logic of the model by studying its filter
values. In the end, we find the most important words in our corpus to our
models logic and remove the rest (95%). New models trained on just the 5% most
important words can achieve the same performance as the original model while
reducing training time by more than half. Approaches such as this will help us
to understand NLP models, explain their decisions according to their word
choices, and improve them by finding blind spots and biases.
","[{'version': 'v1', 'created': 'Tue, 20 Oct 2020 20:12:05 GMT'}]",2020-10-27,"[['Marzban', 'Reza', ''], ['Crick', 'Christopher John', '']]"
1369918,2010.13588,Ozan Caglayan,"Ozan Caglayan, Pranava Madhyastha, Lucia Specia","Curious Case of Language Generation Evaluation Metrics: A Cautionary
  Tale","7 pages, accepted to COLING 2020",,,,cs.CL,http://arxiv.org/licenses/nonexclusive-distrib/1.0/,"  Automatic evaluation of language generation systems is a well-studied problem
in Natural Language Processing. While novel metrics are proposed every year, a
few popular metrics remain as the de facto metrics to evaluate tasks such as
image captioning and machine translation, despite their known limitations. This
is partly due to ease of use, and partly because researchers expect to see them
and know how to interpret them. In this paper, we urge the community for more
careful consideration of how they automatically evaluate their models by
demonstrating important failure cases on multiple datasets, language pairs and
tasks. Our experiments show that metrics (i) usually prefer system outputs to
human-authored texts, (ii) can be insensitive to correct translations of rare
words, (iii) can yield surprisingly high scores when given a single sentence as
system output for the entire test set.
","[{'version': 'v1', 'created': 'Mon, 26 Oct 2020 13:57:20 GMT'}]",2020-10-27,"[['Caglayan', 'Ozan', ''], ['Madhyastha', 'Pranava', ''], ['Specia', 'Lucia', '']]"
1305141,2006.10627,Qian Liu,"Qian Liu, Shengnan An, Jian-Guang Lou, Bei Chen, Zeqi Lin, Yan Gao,
  Bin Zhou, Nanning Zheng, Dongmei Zhang",Compositional Generalization by Learning Analytical Expressions,To appear in NeurIPS 2020 (Spotlight),,,,cs.AI cs.CL,http://arxiv.org/licenses/nonexclusive-distrib/1.0/,"  Compositional generalization is a basic and essential intellective capability
of human beings, which allows us to recombine known parts readily. However,
existing neural network based models have been proven to be extremely deficient
in such a capability. Inspired by work in cognition which argues
compositionality can be captured by variable slots with symbolic functions, we
present a refreshing view that connects a memory-augmented neural model with
analytical expressions, to achieve compositional generalization. Our model
consists of two cooperative neural modules, Composer and Solver, fitting well
with the cognitive argument while being able to be trained in an end-to-end
manner via a hierarchical reinforcement learning algorithm. Experiments on the
well-known benchmark SCAN demonstrate that our model seizes a great ability of
compositional generalization, solving all challenges addressed by previous
works with 100% accuracies.
","[{'version': 'v1', 'created': 'Thu, 18 Jun 2020 15:50:57 GMT'}, {'version': 'v2', 'created': 'Sat, 24 Oct 2020 03:47:49 GMT'}]",2020-10-27,"[['Liu', 'Qian', ''], ['An', 'Shengnan', ''], ['Lou', 'Jian-Guang', ''], ['Chen', 'Bei', ''], ['Lin', 'Zeqi', ''], ['Gao', 'Yan', ''], ['Zhou', 'Bin', ''], ['Zheng', 'Nanning', ''], ['Zhang', 'Dongmei', '']]"
1306638,2006.12124,Anne Wu,"Anne Wu, Changhan Wang, Juan Pino, Jiatao Gu",Self-Supervised Representations Improve End-to-End Speech Translation,Accepted to INTERSPEECH 2020,,,,eess.AS cs.CL cs.SD,http://arxiv.org/licenses/nonexclusive-distrib/1.0/,"  End-to-end speech-to-text translation can provide a simpler and smaller
system but is facing the challenge of data scarcity. Pre-training methods can
leverage unlabeled data and have been shown to be effective on data-scarce
settings. In this work, we explore whether self-supervised pre-trained speech
representations can benefit the speech translation task in both high- and
low-resource settings, whether they can transfer well to other languages, and
whether they can be effectively combined with other common methods that help
improve low-resource end-to-end speech translation such as using a pre-trained
high-resource speech recognition system. We demonstrate that self-supervised
pre-trained features can consistently improve the translation performance, and
cross-lingual transfer allows to extend to a variety of languages without or
with little tuning.
","[{'version': 'v1', 'created': 'Mon, 22 Jun 2020 10:28:38 GMT'}, {'version': 'v2', 'created': 'Sun, 25 Oct 2020 03:31:15 GMT'}]",2020-10-27,"[['Wu', 'Anne', ''], ['Wang', 'Changhan', ''], ['Pino', 'Juan', ''], ['Gu', 'Jiatao', '']]"
1369967,2010.13637,Peng Gao,"Peng Gao, Fei Shao, Xiaoyuan Liu, Xusheng Xiao, Zheng Qin, Fengyuan
  Xu, Prateek Mittal, Sanjeev R. Kulkarni, Dawn Song",Enabling Efficient Cyber Threat Hunting With Cyber Threat Intelligence,,,,,cs.CR cs.CL cs.DB,http://arxiv.org/licenses/nonexclusive-distrib/1.0/,"  Log-based cyber threat hunting has emerged as an important solution to
counter sophisticated cyber attacks. However, existing approaches require
non-trivial efforts of manual query construction and have overlooked the rich
external knowledge about threat behaviors provided by open-source Cyber Threat
Intelligence (OSCTI). To bridge the gap, we propose EffHunter, a system that
facilitates cyber threat hunting in computer systems using OSCTI. Built upon
mature system auditing frameworks, EffHunter provides (1) an unsupervised,
light-weight, and accurate NLP pipeline that extracts structured threat
behaviors from unstructured OSCTI text, (2) a concise and expressive
domain-specific query language, TBQL, to hunt for malicious system activities,
(3) a query synthesis mechanism that automatically synthesizes a TBQL query for
threat hunting from the extracted threat behaviors, and (4) an efficient query
execution engine to search the big audit logging data. Evaluations on a broad
set of attack cases demonstrate the accuracy and efficiency of EffHunter in
enabling practical threat hunting.
","[{'version': 'v1', 'created': 'Mon, 26 Oct 2020 14:54:01 GMT'}]",2020-10-27,"[['Gao', 'Peng', ''], ['Shao', 'Fei', ''], ['Liu', 'Xiaoyuan', ''], ['Xiao', 'Xusheng', ''], ['Qin', 'Zheng', ''], ['Xu', 'Fengyuan', ''], ['Mittal', 'Prateek', ''], ['Kulkarni', 'Sanjeev R.', ''], ['Song', 'Dawn', '']]"
1369988,2010.13658,Baosong Yang,"Tianchi Bi and Liang Yao and Baosong Yang and Haibo Zhang and Weihua
  Luo and Boxing Chen","Constraint Translation Candidates: A Bridge between Neural Query
  Translation and Cross-lingual Information Retrieval",SIGIR eCom 2020,,,,cs.CL cs.IR,http://arxiv.org/licenses/nonexclusive-distrib/1.0/,"  Query translation (QT) is a key component in cross-lingual information
retrieval system (CLIR). With the help of deep learning, neural machine
translation (NMT) has shown promising results on various tasks. However, NMT is
generally trained with large-scale out-of-domain data rather than in-domain
query translation pairs. Besides, the translation model lacks a mechanism at
the inference time to guarantee the generated words to match the search index.
The two shortages of QT result in readable texts for human but inadequate
candidates for the downstream retrieval task. In this paper, we propose a novel
approach to alleviate these problems by limiting the open target vocabulary
search space of QT to a set of important words mined from search index
database. The constraint translation candidates are employed at both of
training and inference time, thus guiding the translation model to learn and
generate well performing target queries. The proposed methods are exploited and
examined in a real-word CLIR system--Aliexpress e-Commerce search engine.
Experimental results demonstrate that our approach yields better performance on
both translation quality and retrieval accuracy than the strong NMT baseline.
","[{'version': 'v1', 'created': 'Mon, 26 Oct 2020 15:27:51 GMT'}]",2020-10-27,"[['Bi', 'Tianchi', ''], ['Yao', 'Liang', ''], ['Yang', 'Baosong', ''], ['Zhang', 'Haibo', ''], ['Luo', 'Weihua', ''], ['Chen', 'Boxing', '']]"
1369989,2010.13659,Baosong Yang,"Liang Yao and Baosong Yang and Haibo Zhang and Weihua Luo and Boxing
  Chen","Exploiting Neural Query Translation into Cross Lingual Information
  Retrieval",SIGIR eCom 2020,,,,cs.CL cs.IR,http://arxiv.org/licenses/nonexclusive-distrib/1.0/,"  As a crucial role in cross-language information retrieval (CLIR), query
translation has three main challenges: 1) the adequacy of translation; 2) the
lack of in-domain parallel training data; and 3) the requisite of low latency.
To this end, existing CLIR systems mainly exploit statistical-based machine
translation (SMT) rather than the advanced neural machine translation (NMT),
limiting the further improvements on both translation and retrieval quality. In
this paper, we investigate how to exploit neural query translation model into
CLIR system. Specifically, we propose a novel data augmentation method that
extracts query translation pairs according to user clickthrough data, thus to
alleviate the problem of domain-adaptation in NMT. Then, we introduce an
asynchronous strategy which is able to leverage the advantages of the real-time
in SMT and the veracity in NMT. Experimental results reveal that the proposed
approach yields better retrieval quality than strong baselines and can be well
applied into a real-world CLIR system, i.e. Aliexpress e-Commerce search
engine. Readers can examine and test their cases on our website:
https://aliexpress.com .
","[{'version': 'v1', 'created': 'Mon, 26 Oct 2020 15:28:19 GMT'}]",2020-10-27,"[['Yao', 'Liang', ''], ['Yang', 'Baosong', ''], ['Zhang', 'Haibo', ''], ['Luo', 'Weihua', ''], ['Chen', 'Boxing', '']]"
1370004,2010.13674,Christina Niklaus,"Thiemo Wambsganss, Christina Niklaus, Matthias S\""ollner, Siegfried
  Handschuh, Jan Marco Leimeister",A Corpus for Argumentative Writing Support in German,"to be published in The 28th International Conference on Computational
  Linguistics (COLING 2020)",,,,cs.CL cs.LG,http://creativecommons.org/licenses/by/4.0/,"  In this paper, we present a novel annotation approach to capture claims and
premises of arguments and their relations in student-written persuasive peer
reviews on business models in German language. We propose an annotation scheme
based on annotation guidelines that allows to model claims and premises as well
as support and attack relations for capturing the structure of argumentative
discourse in student-written peer reviews. We conduct an annotation study with
three annotators on 50 persuasive essays to evaluate our annotation scheme. The
obtained inter-rater agreement of $\alpha=0.57$ for argument components and
$\alpha=0.49$ for argumentative relations indicates that the proposed
annotation scheme successfully guides annotators to moderate agreement.
Finally, we present our freely available corpus of 1,000 persuasive
student-written peer reviews on business models and our annotation guidelines
to encourage future research on the design and development of argumentative
writing support systems for students.
","[{'version': 'v1', 'created': 'Mon, 26 Oct 2020 15:52:12 GMT'}]",2020-10-27,"[['Wambsganss', 'Thiemo', ''], ['Niklaus', 'Christina', ''], ['Söllner', 'Matthias', ''], ['Handschuh', 'Siegfried', ''], ['Leimeister', 'Jan Marco', '']]"
1370018,2010.13688,Alexander Kalinowski,"Alexander Kalinowski, Yuan An","A Survey of Embedding Space Alignment Methods for Language and Knowledge
  Graphs","27 pages, 2 figures",,,,cs.CL cs.AI,http://arxiv.org/licenses/nonexclusive-distrib/1.0/,"  Neural embedding approaches have become a staple in the fields of computer
vision, natural language processing, and more recently, graph analytics. Given
the pervasive nature of these algorithms, the natural question becomes how to
exploit the embedding spaces to map, or align, embeddings of different data
sources. To this end, we survey the current research landscape on word,
sentence and knowledge graph embedding algorithms. We provide a classification
of the relevant alignment techniques and discuss benchmark datasets used in
this field of research. By gathering these diverse approaches into a singular
survey, we hope to further motivate research into alignment of embedding spaces
of varied data types and sources.
","[{'version': 'v1', 'created': 'Mon, 26 Oct 2020 16:08:13 GMT'}]",2020-10-27,"[['Kalinowski', 'Alexander', ''], ['An', 'Yuan', '']]"
1279583,2004.14813,Liying Cheng,"Liying Cheng, Dekun Wu, Lidong Bing, Yan Zhang, Zhanming Jie, Wei Lu,
  Luo Si",ENT-DESC: Entity Description Generation by Exploring Knowledge Graph,"11 pages, 6 figures, accepted by EMNLP 2020",,,,cs.CL,http://arxiv.org/licenses/nonexclusive-distrib/1.0/,"  Previous works on knowledge-to-text generation take as input a few RDF
triples or key-value pairs conveying the knowledge of some entities to generate
a natural language description. Existing datasets, such as WIKIBIO, WebNLG, and
E2E, basically have a good alignment between an input triple/pair set and its
output text. However, in practice, the input knowledge could be more than
enough, since the output description may only cover the most significant
knowledge. In this paper, we introduce a large-scale and challenging dataset to
facilitate the study of such a practical scenario in KG-to-text. Our dataset
involves retrieving abundant knowledge of various types of main entities from a
large knowledge graph (KG), which makes the current graph-to-sequence models
severely suffer from the problems of information loss and parameter explosion
while generating the descriptions. We address these challenges by proposing a
multi-graph structure that is able to represent the original graph information
more comprehensively. Furthermore, we also incorporate aggregation methods that
learn to extract the rich graph information. Extensive experiments demonstrate
the effectiveness of our model architecture.
","[{'version': 'v1', 'created': 'Thu, 30 Apr 2020 14:16:19 GMT'}, {'version': 'v2', 'created': 'Mon, 26 Oct 2020 07:33:32 GMT'}]",2020-10-27,"[['Cheng', 'Liying', ''], ['Wu', 'Dekun', ''], ['Bing', 'Lidong', ''], ['Zhang', 'Yan', ''], ['Jie', 'Zhanming', ''], ['Lu', 'Wei', ''], ['Si', 'Luo', '']]"
1295328,2006.00814,Maha Elbayad,"Maha Elbayad, Michael Ustaszewski, Emmanuelle Esperan\c{c}a-Rodier,
  Francis Brunet Manquat, Laurent Besacier","Online Versus Offline NMT Quality: An In-depth Analysis on
  English-German and German-English",Accepted at COLING 2020,,,,cs.CL,http://arxiv.org/licenses/nonexclusive-distrib/1.0/,"  We conduct in this work an evaluation study comparing offline and online
neural machine translation architectures. Two sequence-to-sequence models:
convolutional Pervasive Attention (Elbayad et al. 2018) and attention-based
Transformer (Vaswani et al. 2017) are considered. We investigate, for both
architectures, the impact of online decoding constraints on the translation
quality through a carefully designed human evaluation on English-German and
German-English language pairs, the latter being particularly sensitive to
latency constraints. The evaluation results allow us to identify the strengths
and shortcomings of each model when we shift to the online setup.
","[{'version': 'v1', 'created': 'Mon, 1 Jun 2020 09:43:54 GMT'}, {'version': 'v2', 'created': 'Sat, 24 Oct 2020 13:36:00 GMT'}]",2020-10-27,"[['Elbayad', 'Maha', ''], ['Ustaszewski', 'Michael', ''], ['Esperança-Rodier', 'Emmanuelle', ''], ['Manquat', 'Francis Brunet', ''], ['Besacier', 'Laurent', '']]"
1369303,2010.12973,Andros Tjandra,"Andros Tjandra, Ruoming Pang, Yu Zhang, Shigeki Karita","Unsupervised Learning of Disentangled Speech Content and Style
  Representation",Submitted to ICASSP 2021,,,,cs.CL cs.SD eess.AS,http://arxiv.org/licenses/nonexclusive-distrib/1.0/,"  We present an approach for unsupervised learning of speech representation
disentangling contents and styles. Our model consists of: (1) a local encoder
that captures per-frame information; (2) a global encoder that captures
per-utterance information; and (3) a conditional decoder that reconstructs
speech given local and global latent variables. Our experiments show that (1)
the local latent variables encode speech contents, as reconstructed speech can
be recognized by ASR with low word error rates (WER), even with a different
global encoding; (2) the global latent variables encode speaker style, as
reconstructed speech shares speaker identity with the source utterance of the
global encoding. Additionally, we demonstrate an useful application from our
pre-trained model, where we can train a speaker recognition model from the
global latent variables and achieve high accuracy by fine-tuning with as few
data as one label per speaker.
","[{'version': 'v1', 'created': 'Sat, 24 Oct 2020 20:16:03 GMT'}]",2020-10-27,"[['Tjandra', 'Andros', ''], ['Pang', 'Ruoming', ''], ['Zhang', 'Yu', ''], ['Karita', 'Shigeki', '']]"
1279693,2004.14923,Arturo Oncevay,"Arturo Oncevay, Barry Haddow, Alexandra Birch","Bridging Linguistic Typology and Multilingual Machine Translation with
  Multi-View Language Representations",Accepted at EMNLP 2020. Camera-ready version,,,,cs.CL,http://arxiv.org/licenses/nonexclusive-distrib/1.0/,"  Sparse language vectors from linguistic typology databases and learned
embeddings from tasks like multilingual machine translation have been
investigated in isolation, without analysing how they could benefit from each
other's language characterisation. We propose to fuse both views using singular
vector canonical correlation analysis and study what kind of information is
induced from each source. By inferring typological features and language
phylogenies, we observe that our representations embed typology and strengthen
correlations with language relationships. We then take advantage of our
multi-view language vector space for multilingual machine translation, where we
achieve competitive overall translation accuracy in tasks that require
information about language similarities, such as language clustering and
ranking candidates for multilingual transfer. With our method, which is also
released as a tool, we can easily project and assess new languages without
expensive retraining of massive multilingual or ranking models, which are major
disadvantages of related approaches.
","[{'version': 'v1', 'created': 'Thu, 30 Apr 2020 16:25:39 GMT'}, {'version': 'v2', 'created': 'Sun, 25 Oct 2020 20:51:46 GMT'}]",2020-10-27,"[['Oncevay', 'Arturo', ''], ['Haddow', 'Barry', ''], ['Birch', 'Alexandra', '']]"
