,id,submitter,authors,title,comments,journal-ref,doi,report-no,categories,license,abstract,versions,update_date,authors_parsed
1370811,2010.14481,Biao Zhang,"Biao Zhang, Ivan Titov, Rico Sennrich",Fast Interleaved Bidirectional Sequence Generation,"WMT2020, source code is at
  https://github.com/bzhangGo/zero/tree/master/docs/interleaved_bidirectional_transformer",,,,cs.CL cs.LG,http://arxiv.org/licenses/nonexclusive-distrib/1.0/,"  Independence assumptions during sequence generation can speed up inference,
but parallel generation of highly inter-dependent tokens comes at a cost in
quality. Instead of assuming independence between neighbouring tokens
(semi-autoregressive decoding, SA), we take inspiration from bidirectional
sequence generation and introduce a decoder that generates target words from
the left-to-right and right-to-left directions simultaneously. We show that we
can easily convert a standard architecture for unidirectional decoding into a
bidirectional decoder by simply interleaving the two directions and adapting
the word positions and self-attention masks. Our interleaved bidirectional
decoder (IBDecoder) retains the model simplicity and training efficiency of the
standard Transformer, and on five machine translation tasks and two document
summarization tasks, achieves a decoding speedup of ~2X compared to
autoregressive decoding with comparable quality. Notably, it outperforms
left-to-right SA because the independence assumptions in IBDecoder are more
felicitous. To achieve even higher speedups, we explore hybrid models where we
either simultaneously predict multiple neighbouring tokens per direction, or
perform multi-directional decoding by partitioning the target sequence. These
methods achieve speedups to 4X-11X across different tasks at the cost of <1
BLEU or <0.5 ROUGE (on average). Source code is released at
https://github.com/bzhangGo/zero.
","[{'version': 'v1', 'created': 'Tue, 27 Oct 2020 17:38:51 GMT'}]",2020-10-28,"[['Zhang', 'Biao', ''], ['Titov', 'Ivan', ''], ['Sennrich', 'Rico', '']]"
1246301,2002.08878,Clement Moulin-Frier,Cl\'ement Moulin-Frier and Pierre-Yves Oudeyer,"Multi-Agent Reinforcement Learning as a Computational Tool for Language
  Evolution Research: Historical Context and Future Challenges",,"Challenges and Opportunities for Multi-Agent Reinforcement
  Learning (COMARL AAAI 2020-2021), AAAI Spring Symposium Series, Stanford
  University, Palo Alto, California, USA",,,cs.MA cs.CL cs.LG,http://arxiv.org/licenses/nonexclusive-distrib/1.0/,"  Computational models of emergent communication in agent populations are
currently gaining interest in the machine learning community due to recent
advances in Multi-Agent Reinforcement Learning (MARL). Current contributions
are however still relatively disconnected from the earlier theoretical and
computational literature aiming at understanding how language might have
emerged from a prelinguistic substance. The goal of this paper is to position
recent MARL contributions within the historical context of language evolution
research, as well as to extract from this theoretical and computational
background a few challenges for future research.
","[{'version': 'v1', 'created': 'Thu, 20 Feb 2020 17:26:46 GMT'}, {'version': 'v2', 'created': 'Tue, 27 Oct 2020 13:54:46 GMT'}]",2020-10-28,"[['Moulin-Frier', 'Clément', ''], ['Oudeyer', 'Pierre-Yves', '']]"
1352508,2009.11005,Khang Nguyen,Khang Phuoc-Quy Nguyen and Kiet Van Nguyen,"Exploiting Vietnamese Social Media Characteristics for Textual Emotion
  Recognition in Vietnamese","6 pages, 9 tables, 2 figures of table, conference",,,,cs.CL,http://arxiv.org/licenses/nonexclusive-distrib/1.0/,"  Textual emotion recognition has been a promising research topic in recent
years. Many researchers aim to build more accurate and robust emotion detection
systems. In this paper, we conduct several experiments to indicate how data
pre-processing affects a machine learning method on textual emotion
recognition. These experiments are performed on the Vietnamese Social Media
Emotion Corpus (UIT-VSMEC) as the benchmark dataset. We explore Vietnamese
social media characteristics to propose different pre-processing techniques,
and key-clause extraction with emotional context to improve the machine
performance on UIT-VSMEC. Our experimental evaluation shows that with
appropriate pre-processing techniques based on Vietnamese social media
characteristics, Multinomial Logistic Regression (MLR) achieves the best
F1-score of 64.40%, a significant improvement of 4.66% over the CNN model built
by the authors of UIT-VSMEC (59.74%).
","[{'version': 'v1', 'created': 'Wed, 23 Sep 2020 08:49:39 GMT'}, {'version': 'v2', 'created': 'Fri, 25 Sep 2020 15:46:49 GMT'}, {'version': 'v3', 'created': 'Tue, 27 Oct 2020 14:39:40 GMT'}]",2020-10-28,"[['Nguyen', 'Khang Phuoc-Quy', ''], ['Van Nguyen', 'Kiet', '']]"
1280128,2005.00333,Edoardo Maria Ponti,"Edoardo Maria Ponti, Goran Glava\v{s}, Olga Majewska, Qianchu Liu,
  Ivan Vuli\'c and Anna Korhonen",XCOPA: A Multilingual Dataset for Causal Commonsense Reasoning,,,,,cs.CL,http://arxiv.org/licenses/nonexclusive-distrib/1.0/,"  In order to simulate human language capacity, natural language processing
systems must be able to reason about the dynamics of everyday situations,
including their possible causes and effects. Moreover, they should be able to
generalise the acquired world knowledge to new languages, modulo cultural
differences. Advances in machine reasoning and cross-lingual transfer depend on
the availability of challenging evaluation benchmarks. Motivated by both
demands, we introduce Cross-lingual Choice of Plausible Alternatives (XCOPA), a
typologically diverse multilingual dataset for causal commonsense reasoning in
11 languages, which includes resource-poor languages like Eastern Apur\'imac
Quechua and Haitian Creole. We evaluate a range of state-of-the-art models on
this novel dataset, revealing that the performance of current methods based on
multilingual pretraining and zero-shot fine-tuning falls short compared to
translation-based transfer. Finally, we propose strategies to adapt
multilingual models to out-of-sample resource-lean languages where only a small
corpus or a bilingual dictionary is available, and report substantial
improvements over the random baseline. The XCOPA dataset is freely available at
github.com/cambridgeltl/xcopa.
","[{'version': 'v1', 'created': 'Fri, 1 May 2020 12:22:33 GMT'}, {'version': 'v2', 'created': 'Mon, 26 Oct 2020 23:23:58 GMT'}]",2020-10-28,"[['Ponti', 'Edoardo Maria', ''], ['Glavaš', 'Goran', ''], ['Majewska', 'Olga', ''], ['Liu', 'Qianchu', ''], ['Vulić', 'Ivan', ''], ['Korhonen', 'Anna', '']]"
1353816,2009.12313,Iacer Calixto,Victor Milewski and Marie-Francine Moens and Iacer Calixto,Are scene graphs good enough to improve Image Captioning?,"Published at AACL-IJCNLP 2020. 12 pages, 5 figures",,,,cs.CV cs.CL,http://arxiv.org/licenses/nonexclusive-distrib/1.0/,"  Many top-performing image captioning models rely solely on object features
computed with an object detection model to generate image descriptions.
However, recent studies propose to directly use scene graphs to introduce
information about object relations into captioning, hoping to better describe
interactions between objects. In this work, we thoroughly investigate the use
of scene graphs in image captioning. We empirically study whether using
additional scene graph encoders can lead to better image descriptions and
propose a conditional graph attention network (C-GAT), where the image
captioning decoder state is used to condition the graph updates. Finally, we
determine to what extent noise in the predicted scene graphs influence caption
quality. Overall, we find no significant difference between models that use
scene graph features and models that only use object detection features across
different captioning metrics, which suggests that existing scene graph
generation models are still too noisy to be useful in image captioning.
Moreover, although the quality of predicted scene graphs is very low in
general, when using high quality scene graphs we obtain gains of up to 3.3
CIDEr compared to a strong Bottom-Up Top-Down baseline. We open source code to
reproduce all our experiments in
https://github.com/iacercalixto/butd-image-captioning.
","[{'version': 'v1', 'created': 'Fri, 25 Sep 2020 16:09:08 GMT'}, {'version': 'v2', 'created': 'Tue, 27 Oct 2020 17:55:55 GMT'}]",2020-10-28,"[['Milewski', 'Victor', ''], ['Moens', 'Marie-Francine', ''], ['Calixto', 'Iacer', '']]"
1370778,2010.14448,Xavier Ferrer Aran,"Xavier Ferrer-Aran, Tom van Nuenen, Natalia Criado, Jose M. Such",Discovering and Interpreting Conceptual Biases in Online Communities,,,,,cs.CL cs.AI cs.CY,http://arxiv.org/licenses/nonexclusive-distrib/1.0/,"  Language carries implicit human biases, functioning both as a reflection and
a perpetuation of stereotypes that people carry with them. Recently, ML-based
NLP methods such as word embeddings have been shown to learn such language
biases with striking accuracy. This capability of word embeddings has been
successfully exploited as a tool to quantify and study human biases. However,
previous studies only consider a predefined set of conceptual biases to attest
(e.g., whether gender is more or less associated with particular jobs), or just
discover biased words without helping to understand their meaning at the
conceptual level. As such, these approaches are either unable to find
conceptual biases that have not been defined in advance, or the biases they
find are difficult to interpret and study. This makes existing approaches
unsuitable to discover and interpret biases in online communities, as such
communities may carry different biases than those in mainstream culture. This
paper proposes a general, data-driven approach to automatically discover and
help interpret conceptual biases encoded in word embeddings. We apply this
approach to study the conceptual biases present in the language used in online
communities and experimentally show the validity and stability of our method.
","[{'version': 'v1', 'created': 'Tue, 27 Oct 2020 17:07:12 GMT'}]",2020-10-28,"[['Ferrer-Aran', 'Xavier', ''], ['van Nuenen', 'Tom', ''], ['Criado', 'Natalia', ''], ['Such', 'Jose M.', '']]"
1370794,2010.14464,Lukasz Borchmann,"{\L}ukasz Borchmann, Dawid Jurkiewicz, Filip Grali\'nski, Tomasz
  G\'orecki","Dynamic Boundary Time Warping for Sub-sequence Matching with Few
  Examples",,,,,cs.DS cs.CL cs.IR,http://arxiv.org/licenses/nonexclusive-distrib/1.0/,"  The paper presents a novel method of finding a fragment in a long temporal
sequence similar to the set of shorter sequences. We are the first to propose
an algorithm for such a search that does not rely on computing the average
sequence from query examples. Instead, we use query examples as is, utilizing
all of them simultaneously. The introduced method based on the Dynamic Time
Warping (DTW) technique is suited explicitly for few-shot query-by-example
retrieval tasks. We evaluate it on two different few-shot problems from the
field of Natural Language Processing. The results show it either outperforms
baselines and previous approaches or achieves comparable results when a low
number of examples is available.
","[{'version': 'v1', 'created': 'Tue, 27 Oct 2020 17:23:18 GMT'}]",2020-10-28,"[['Borchmann', 'Łukasz', ''], ['Jurkiewicz', 'Dawid', ''], ['Graliński', 'Filip', ''], ['Górecki', 'Tomasz', '']]"
998122,1807.00914,Edoardo Maria Ponti,"Edoardo Maria Ponti, Helen O'Horan, Yevgeni Berzak, Ivan Vuli\'c, Roi
  Reichart, Thierry Poibeau, Ekaterina Shutova, Anna Korhonen","Modeling Language Variation and Universals: A Survey on Typological
  Linguistics for Natural Language Processing",,,,,cs.CL,http://arxiv.org/licenses/nonexclusive-distrib/1.0/,"  Linguistic typology aims to capture structural and semantic variation across
the world's languages. A large-scale typology could provide excellent guidance
for multilingual Natural Language Processing (NLP), particularly for languages
that suffer from the lack of human labeled resources. We present an extensive
literature survey on the use of typological information in the development of
NLP techniques. Our survey demonstrates that to date, the use of information in
existing typological databases has resulted in consistent but modest
improvements in system performance. We show that this is due to both intrinsic
limitations of databases (in terms of coverage and feature granularity) and
under-employment of the typological features included in them. We advocate for
a new approach that adapts the broad and discrete nature of typological
categories to the contextual and continuous nature of machine learning
algorithms used in contemporary NLP. In particular, we suggest that such
approach could be facilitated by recent developments in data-driven induction
of typological knowledge.
","[{'version': 'v1', 'created': 'Mon, 2 Jul 2018 22:09:59 GMT'}, {'version': 'v2', 'created': 'Wed, 27 Feb 2019 19:55:28 GMT'}, {'version': 'v3', 'created': 'Mon, 26 Oct 2020 23:23:45 GMT'}]",2020-10-28,"[['Ponti', 'Edoardo Maria', ''], [""O'Horan"", 'Helen', ''], ['Berzak', 'Yevgeni', ''], ['Vulić', 'Ivan', ''], ['Reichart', 'Roi', ''], ['Poibeau', 'Thierry', ''], ['Shutova', 'Ekaterina', ''], ['Korhonen', 'Anna', '']]"
1355762,2009.14259,Peter Jansen,Peter A. Jansen,"Visually-Grounded Planning without Vision: Language Models Infer
  Detailed Plans from High-level Instructions","Accepted to Findings of EMNLP. V2: corrected typo Table 1; margins
  Table 3",,,,cs.CL cs.CV,http://creativecommons.org/licenses/by/4.0/,"  The recently proposed ALFRED challenge task aims for a virtual robotic agent
to complete complex multi-step everyday tasks in a virtual home environment
from high-level natural language directives, such as ""put a hot piece of bread
on a plate"". Currently, the best-performing models are able to complete less
than 5% of these tasks successfully. In this work we focus on modeling the
translation problem of converting natural language directives into detailed
multi-step sequences of actions that accomplish those goals in the virtual
environment. We empirically demonstrate that it is possible to generate gold
multi-step plans from language directives alone without any visual input in 26%
of unseen cases. When a small amount of visual information is incorporated,
namely the starting location in the virtual environment, our best-performing
GPT-2 model successfully generates gold command sequences in 58% of cases. Our
results suggest that contextualized language models may provide strong visual
semantic planning modules for grounded virtual agents.
","[{'version': 'v1', 'created': 'Tue, 29 Sep 2020 18:52:39 GMT'}, {'version': 'v2', 'created': 'Mon, 26 Oct 2020 19:16:00 GMT'}]",2020-10-28,"[['Jansen', 'Peter A.', '']]"
776112,1610.00765,Edoardo Maria Ponti,"Edoardo Maria Ponti, Elisabetta Jezek, Bernardo Magnini","Distributed Representations of Lexical Sets and Prototypes in Causal
  Alternation Verbs","5 pages, 4 figures, accepted at: Third Italian Conference on
  Computational Linguistics (CLIC-it). 5-6 December 2016, Napoli (Italy)",,,,cs.CL,http://arxiv.org/licenses/nonexclusive-distrib/1.0/,"  Lexical sets contain the words filling an argument slot of a verb, and are in
part determined by selectional preferences. The purpose of this paper is to
unravel the properties of lexical sets through distributional semantics. We
investigate 1) whether lexical set behave as prototypical categories with a
centre and a periphery; 2) whether they are polymorphic, i.e. composed by
subcategories; 3) whether the distance between lexical sets of different
arguments is explanatory of verb properties. In particular, our case study are
lexical sets of causative-inchoative verbs in Italian. Having studied several
vector models, we find that 1) based on spatial distance from the centroid,
object fillers are scattered uniformly across the category, whereas
intransitive subject fillers lie on its edge; 2) a correlation exists between
the amount of verb senses and that of clusters discovered automatically,
especially for intransitive subjects; 3) the distance between the centroids of
object and intransitive subject is correlated with other properties of verbs,
such as their cross-lingual tendency to appear in the intransitive pattern
rather than transitive one. This paper is noncommittal with respect to the
hypothesis that this connection is underpinned by a semantic reason, namely the
spontaneity of the event denoted by the verb.
","[{'version': 'v1', 'created': 'Mon, 3 Oct 2016 21:50:27 GMT'}, {'version': 'v2', 'created': 'Mon, 26 Oct 2020 23:48:14 GMT'}]",2020-10-28,"[['Ponti', 'Edoardo Maria', ''], ['Jezek', 'Elisabetta', ''], ['Magnini', 'Bernardo', '']]"
1362519,2010.06189,Zhengbao Jiang,"Zhengbao Jiang, Antonios Anastasopoulos, Jun Araki, Haibo Ding, Graham
  Neubig","X-FACTR: Multilingual Factual Knowledge Retrieval from Pretrained
  Language Models",EMNLP 2020,,,,cs.CL,http://arxiv.org/licenses/nonexclusive-distrib/1.0/,"  Language models (LMs) have proven surprisingly successful at capturing
factual knowledge by completing cloze-style fill-in-the-blank questions such as
""Punta Cana is located in _."" However, while knowledge is both written and
queried in many languages, studies on LMs' factual representation ability have
almost invariably been performed on English. To assess factual knowledge
retrieval in LMs in different languages, we create a multilingual benchmark of
cloze-style probes for 23 typologically diverse languages. To properly handle
language variations, we expand probing methods from single- to multi-word
entities, and develop several decoding algorithms to generate multi-token
predictions. Extensive experimental results provide insights about how well (or
poorly) current state-of-the-art LMs perform at this task in languages with
more or fewer available resources. We further propose a code-switching-based
method to improve the ability of multilingual LMs to access knowledge, and
verify its effectiveness on several benchmark languages. Benchmark data and
code have been released at https://x-factr.github.io.
","[{'version': 'v1', 'created': 'Tue, 13 Oct 2020 05:29:56 GMT'}, {'version': 'v2', 'created': 'Wed, 14 Oct 2020 22:23:17 GMT'}, {'version': 'v3', 'created': 'Tue, 27 Oct 2020 15:30:03 GMT'}]",2020-10-28,"[['Jiang', 'Zhengbao', ''], ['Anastasopoulos', 'Antonios', ''], ['Araki', 'Jun', ''], ['Ding', 'Haibo', ''], ['Neubig', 'Graham', '']]"
1362726,2010.06396,Ekta Sood,"Ekta Sood, Simon Tannert, Diego Frassinelli, Andreas Bulling and Ngoc
  Thang Vu","Interpreting Attention Models with Human Visual Attention in Machine
  Reading Comprehension",CoNLL 2020,,,,cs.CL,http://arxiv.org/licenses/nonexclusive-distrib/1.0/,"  While neural networks with attention mechanisms have achieved superior
performance on many natural language processing tasks, it remains unclear to
which extent learned attention resembles human visual attention. In this paper,
we propose a new method that leverages eye-tracking data to investigate the
relationship between human visual attention and neural attention in machine
reading comprehension. To this end, we introduce a novel 23 participant eye
tracking dataset - MQA-RC, in which participants read movie plots and answered
pre-defined questions. We compare state of the art networks based on long
short-term memory (LSTM), convolutional neural models (CNN) and XLNet
Transformer architectures. We find that higher similarity to human attention
and performance significantly correlates to the LSTM and CNN models. However,
we show this relationship does not hold true for the XLNet models -- despite
the fact that the XLNet performs best on this challenging task. Our results
suggest that different architectures seem to learn rather different neural
attention strategies and similarity of neural to human attention does not
guarantee best performance.
","[{'version': 'v1', 'created': 'Tue, 13 Oct 2020 13:51:57 GMT'}, {'version': 'v2', 'created': 'Tue, 27 Oct 2020 14:47:51 GMT'}]",2020-10-28,"[['Sood', 'Ekta', ''], ['Tannert', 'Simon', ''], ['Frassinelli', 'Diego', ''], ['Bulling', 'Andreas', ''], ['Vu', 'Ngoc Thang', '']]"
1364221,2010.07891,Ekta Sood,"Ekta Sood, Simon Tannert, Philipp Mueller, Andreas Bulling","Improving Natural Language Processing Tasks with Human Gaze-Guided
  Neural Attention",NeurIPS 2020,,,,cs.CL cs.LG,http://arxiv.org/licenses/nonexclusive-distrib/1.0/,"  A lack of corpora has so far limited advances in integrating human gaze data
as a supervisory signal in neural attention mechanisms for natural language
processing(NLP). We propose a novel hybrid text saliency model(TSM) that, for
the first time, combines a cognitive model of reading with explicit human gaze
supervision in a single machine learning framework. On four different corpora
we demonstrate that our hybrid TSM duration predictions are highly correlated
with human gaze ground truth. We further propose a novel joint modeling
approach to integrate TSM predictions into the attention layer of a network
designed for a specific upstream NLP task without the need for any
task-specific human gaze data. We demonstrate that our joint model outperforms
the state of the art in paraphrase generation on the Quora Question Pairs
corpus by more than 10% in BLEU-4 and achieves state of the art performance for
sentence compression on the challenging Google Sentence Compression corpus. As
such, our work introduces a practical approach for bridging between data-driven
and cognitive models and demonstrates a new way to integrate human gaze-guided
neural attention into NLP tasks.
","[{'version': 'v1', 'created': 'Thu, 15 Oct 2020 17:14:09 GMT'}, {'version': 'v2', 'created': 'Tue, 27 Oct 2020 16:16:18 GMT'}]",2020-10-28,"[['Sood', 'Ekta', ''], ['Tannert', 'Simon', ''], ['Mueller', 'Philipp', ''], ['Bulling', 'Andreas', '']]"
1177919,1909.07881,Palakorn Achananuparp,"Helena Lee, Palakorn Achananuparp, Yue Liu, Ee-Peng Lim, Lav R.
  Varshney","Estimating Glycemic Impact of Cooking Recipes via Online Crowdsourcing
  and Machine Learning","To appear in the Proceedings of Digital Public Health 2019 as short
  paper",,10.1145/3357729.3357748,,cs.CY cs.CL cs.LG,http://arxiv.org/licenses/nonexclusive-distrib/1.0/,"  Consumption of diets with low glycemic impact is highly recommended for
diabetics and pre-diabetics as it helps maintain their blood glucose levels.
However, laboratory analysis of dietary glycemic potency is time-consuming and
expensive. In this paper, we explore a data-driven approach utilizing online
crowdsourcing and machine learning to estimate the glycemic impact of cooking
recipes. We show that a commonly used healthiness metric may not always be
effective in determining recipes suitable for diabetics, thus emphasizing the
importance of the glycemic-impact estimation task. Our best classification
model, trained on nutritional and crowdsourced data obtained from Amazon
Mechanical Turk (AMT), can accurately identify recipes which are unhealthful
for diabetics.
","[{'version': 'v1', 'created': 'Tue, 17 Sep 2019 15:14:51 GMT'}]",2020-10-28,"[['Lee', 'Helena', ''], ['Achananuparp', 'Palakorn', ''], ['Liu', 'Yue', ''], ['Lim', 'Ee-Peng', ''], ['Varshney', 'Lav R.', '']]"
1299720,2006.05206,Jayden Macklin-Cordes,"Jayden L. Macklin-Cordes, Erich R. Round",Re-evaluating phoneme frequencies,"29pp (3 figures, 3 tables). This article has been provisionally
  accepted for publication (Frontiers in Psychology, Language Sciences).
  Supplementary information, data and code available at
  http://doi.org/10.5281/zenodo.3886212",,10.3389/fpsyg.2020.570895,,cs.CL physics.soc-ph stat.AP,http://arxiv.org/licenses/nonexclusive-distrib/1.0/,"  Causal processes can give rise to distinctive distributions in the linguistic
variables that they affect. Consequently, a secure understanding of a
variable's distribution can hold a key to understanding the forces that have
causally shaped it. A storied distribution in linguistics has been Zipf's law,
a kind of power law. In the wake of a major debate in the sciences around
power-law hypotheses and the unreliability of earlier methods of evaluating
them, here we re-evaluate the distributions claimed to characterize phoneme
frequencies. We infer the fit of power laws and three alternative distributions
to 166 Australian languages, using a maximum likelihood framework. We find
evidence supporting earlier results, but also nuancing them and increasing our
understanding of them. Most notably, phonemic inventories appear to have a
Zipfian-like frequency structure among their most-frequent members (though
perhaps also a lognormal structure) but a geometric (or exponential) structure
among the least-frequent. We compare these new insights the kinds of causal
processes that affect the evolution of phonemic inventories over time, and
identify a potential account for why, despite there being an important role for
phonetic substance in phonemic change, we could still expect inventories with
highly diverse phonetic content to share similar distributions of phoneme
frequencies. We conclude with priorities for future work in this promising
program of research.
","[{'version': 'v1', 'created': 'Tue, 9 Jun 2020 12:05:10 GMT'}, {'version': 'v2', 'created': 'Tue, 27 Oct 2020 03:56:14 GMT'}]",2020-10-28,"[['Macklin-Cordes', 'Jayden L.', ''], ['Round', 'Erich R.', '']]"
