,id,submitter,authors,title,comments,journal-ref,doi,report-no,categories,license,abstract,versions,update_date,authors_parsed
1370906,2010.14576,Jeniya Tabassum,"Jeniya Tabassum, Sydney Lee, Wei Xu, Alan Ritter","WNUT-2020 Task 1 Overview: Extracting Entities and Relations from Wet
  Lab Protocols",to appear in EMNLP 2020 (WNUT),,,,cs.CL,http://arxiv.org/licenses/nonexclusive-distrib/1.0/,"  This paper presents the results of the wet lab information extraction task at
WNUT 2020. This task consisted of two sub tasks: (1) a Named Entity Recognition
(NER) task with 13 participants and (2) a Relation Extraction (RE) task with 2
participants. We outline the task, data annotation process, corpus statistics,
and provide a high-level overview of the participating systems for each sub
task.
","[{'version': 'v1', 'created': 'Tue, 27 Oct 2020 19:34:53 GMT'}]",2020-10-29,"[['Tabassum', 'Jeniya', ''], ['Lee', 'Sydney', ''], ['Xu', 'Wei', ''], ['Ritter', 'Alan', '']]"
1370898,2010.14568,Kaiyu Yang,"Kaiyu Yang, Jia Deng",Strongly Incremental Constituency Parsing with Graph Neural Networks,Accepted to NeurIPS 2020,,,,cs.CL,http://arxiv.org/licenses/nonexclusive-distrib/1.0/,"  Parsing sentences into syntax trees can benefit downstream applications in
NLP. Transition-based parsers build trees by executing actions in a state
transition system. They are computationally efficient, and can leverage machine
learning to predict actions based on partial trees. However, existing
transition-based parsers are predominantly based on the shift-reduce transition
system, which does not align with how humans are known to parse sentences.
Psycholinguistic research suggests that human parsing is strongly incremental:
humans grow a single parse tree by adding exactly one token at each step. In
this paper, we propose a novel transition system called attach-juxtapose. It is
strongly incremental; it represents a partial sentence using a single tree;
each action adds exactly one token into the partial tree. Based on our
transition system, we develop a strongly incremental parser. At each step, it
encodes the partial tree using a graph neural network and predicts an action.
We evaluate our parser on Penn Treebank (PTB) and Chinese Treebank (CTB). On
PTB, it outperforms existing parsers trained with only constituency trees; and
it performs on par with state-of-the-art parsers that use dependency trees as
additional training data. On CTB, our parser establishes a new state of the
art. Code is available at
https://github.com/princeton-vl/attach-juxtapose-parser.
","[{'version': 'v1', 'created': 'Tue, 27 Oct 2020 19:19:38 GMT'}]",2020-10-29,"[['Yang', 'Kaiyu', ''], ['Deng', 'Jia', '']]"
1370887,2010.14557,Ruizhe Li,"Xiao Li, Guanyi Chen, Chenghua Lin, Ruizhe Li",DGST: a Dual-Generator Network for Text Style Transfer,"Accepted by EMNLP 2020, camera ready version",,,,cs.CL cs.LG,http://arxiv.org/licenses/nonexclusive-distrib/1.0/,"  We propose DGST, a novel and simple Dual-Generator network architecture for
text Style Transfer. Our model employs two generators only, and does not rely
on any discriminators or parallel corpus for training. Both quantitative and
qualitative experiments on the Yelp and IMDb datasets show that our model gives
competitive performance compared to several strong baselines with more
complicated architecture designs.
","[{'version': 'v1', 'created': 'Tue, 27 Oct 2020 18:54:51 GMT'}]",2020-10-29,"[['Li', 'Xiao', ''], ['Chen', 'Guanyi', ''], ['Lin', 'Chenghua', ''], ['Li', 'Ruizhe', '']]"
1370864,2010.14534,Marion Bartl,Marion Bartl and Malvina Nissim and Albert Gatt,"Unmasking Contextual Stereotypes: Measuring and Mitigating BERT's Gender
  Bias","10 pages, 4 figures, to appear in Proceedings of the 2nd Workshop on
  Gender Bias in Natural Language Processing at COLING 2020",,,,cs.CL,http://creativecommons.org/licenses/by/4.0/,"  Contextualized word embeddings have been replacing standard embeddings as the
representational knowledge source of choice in NLP systems. Since a variety of
biases have previously been found in standard word embeddings, it is crucial to
assess biases encoded in their replacements as well. Focusing on BERT (Devlin
et al., 2018), we measure gender bias by studying associations between
gender-denoting target words and names of professions in English and German,
comparing the findings with real-world workforce statistics. We mitigate bias
by fine-tuning BERT on the GAP corpus (Webster et al., 2018), after applying
Counterfactual Data Substitution (CDS) (Maudslay et al., 2019). We show that
our method of measuring bias is appropriate for languages such as English, but
not for languages with a rich morphology and gender-marking, such as German.
Our results highlight the importance of investigating bias and mitigation
techniques cross-linguistically, especially in view of the current emphasis on
large-scale, multilingual language models.
","[{'version': 'v1', 'created': 'Tue, 27 Oct 2020 18:06:09 GMT'}]",2020-10-29,"[['Bartl', 'Marion', ''], ['Nissim', 'Malvina', ''], ['Gatt', 'Albert', '']]"
1146834,1907.02298,Zi Lin,"Junjie Cao, Zi Lin, Weiwei Sun, Xiaojun Wan","A Comparative Analysis of Knowledge-Intensive and Data-Intensive
  Semantic Parsers",submitted to the journal Computational Linguistics,,,,cs.CL,http://creativecommons.org/licenses/by/4.0/,"  We present a phenomenon-oriented comparative analysis of the two dominant
approaches in task-independent semantic parsing: classic, knowledge-intensive
and neural, data-intensive models. To reflect state-of-the-art neural NLP
technologies, we introduce a new target structure-centric parser that can
produce semantic graphs much more accurately than previous data-driven parsers.
We then show that, in spite of comparable performance overall, knowledge- and
data-intensive models produce different types of errors, in a way that can be
explained by their theoretical properties. This analysis leads to new
directions for parser development.
","[{'version': 'v1', 'created': 'Thu, 4 Jul 2019 09:40:27 GMT'}, {'version': 'v2', 'created': 'Thu, 15 Aug 2019 10:36:59 GMT'}, {'version': 'v3', 'created': 'Wed, 28 Oct 2020 08:39:30 GMT'}]",2020-10-29,"[['Cao', 'Junjie', ''], ['Lin', 'Zi', ''], ['Sun', 'Weiwei', ''], ['Wan', 'Xiaojun', '']]"
1247530,2002.10107,Issa Annamoradnejad,"Issa Annamoradnejad, Mohammadamin Fazli, Jafar Habibi",Predicting Subjective Features of Questions of QA Websites using BERT,"5 pages, 4 figures, 2 tables","2020 6th International Conference on Web Research (ICWR), Tehran,
  Iran, 2020, pp. 240-244",10.1109/ICWR49608.2020.9122318,,cs.CL cs.AI cs.LG,http://arxiv.org/licenses/nonexclusive-distrib/1.0/,"  Community Question-Answering websites, such as StackOverflow and Quora,
expect users to follow specific guidelines in order to maintain content
quality. These systems mainly rely on community reports for assessing contents,
which has serious problems such as the slow handling of violations, the loss of
normal and experienced users' time, the low quality of some reports, and
discouraging feedback to new users. Therefore, with the overall goal of
providing solutions for automating moderation actions in Q&A websites, we aim
to provide a model to predict 20 quality or subjective aspects of questions in
QA websites. To this end, we used data gathered by the CrowdSource team at
Google Research in 2019 and a fine-tuned pre-trained BERT model on our problem.
Based on the evaluation by Mean-Squared-Error (MSE), the model achieved a value
of 0.046 after 2 epochs of training, which did not improve substantially in the
next ones. Results confirm that by simple fine-tuning, we can achieve accurate
models in little time and on less amount of data.
","[{'version': 'v1', 'created': 'Mon, 24 Feb 2020 07:56:02 GMT'}, {'version': 'v2', 'created': 'Wed, 25 Mar 2020 08:10:16 GMT'}, {'version': 'v3', 'created': 'Tue, 30 Jun 2020 13:22:04 GMT'}, {'version': 'v4', 'created': 'Wed, 28 Oct 2020 14:37:39 GMT'}]",2020-10-29,"[['Annamoradnejad', 'Issa', ''], ['Fazli', 'Mohammadamin', ''], ['Habibi', 'Jafar', '']]"
1369332,2010.13002,Sam Shleifer,Sam Shleifer and Alexander M. Rush,Pre-trained Summarization Distillation,,,,,cs.CL cs.AI,http://arxiv.org/licenses/nonexclusive-distrib/1.0/,"  Recent state-of-the-art approaches to summarization utilize large pre-trained
Transformer models. Distilling these models to smaller student models has
become critically important for practical use; however there are many different
distillation methods proposed by the NLP literature. Recent work on distilling
BERT for classification and regression tasks shows strong performance using
direct knowledge distillation. Alternatively, machine translation practitioners
distill using pseudo-labeling, where a small model is trained on the
translations of a larger model. A third, simpler approach is to 'shrink and
fine-tune' (SFT), which avoids any explicit distillation by copying parameters
to a smaller student model and then fine-tuning. We compare these three
approaches for distillation of Pegasus and BART, the current and former state
of the art, pre-trained summarization models, and find that SFT outperforms
knowledge distillation and pseudo-labeling on the CNN/DailyMail dataset, but
under-performs pseudo-labeling on the more abstractive XSUM dataset. PyTorch
Code and checkpoints of different sizes are available through Hugging Face
transformers here http://tiny.cc/4iy0tz.
","[{'version': 'v1', 'created': 'Sat, 24 Oct 2020 23:15:43 GMT'}, {'version': 'v2', 'created': 'Wed, 28 Oct 2020 04:47:59 GMT'}]",2020-10-29,"[['Shleifer', 'Sam', ''], ['Rush', 'Alexander M.', '']]"
1371221,2010.14891,Mayuko Kori,"Mayuko Kori, Takeshi Tsukada and Naoki Kobayashi",A Cyclic Proof System for HFLN,27 pages,,,,cs.LO cs.CL,http://arxiv.org/licenses/nonexclusive-distrib/1.0/,"  A cyclic proof system allows us to perform inductive reasoning without
explicit inductions. We propose a cyclic proof system for HFLN, which is a
higher-order predicate logic with natural numbers and alternating fixed-points.
Ours is the first cyclic proof system for a higher-order logic, to our
knowledge. Due to the presence of higher-order predicates and alternating
fixed-points, our cyclic proof system requires a more delicate global condition
on cyclic proofs than the original system of Brotherston and Simpson. We prove
the decidability of checking the global condition and soundness of this system,
and also prove a restricted form of standard completeness for an infinitary
variant of our cyclic proof system. A potential application of our cyclic proof
system is semi-automated verification of higher-order programs, based on
Kobayashi et al.'s recent work on reductions from program verification to HFLN
validity checking.
","[{'version': 'v1', 'created': 'Wed, 28 Oct 2020 11:19:53 GMT'}]",2020-10-29,"[['Kori', 'Mayuko', ''], ['Tsukada', 'Takeshi', ''], ['Kobayashi', 'Naoki', '']]"
1371250,2010.14920,Yuchen Liu,"Yuchen Liu, Junnan Zhu, Jiajun Zhang, and Chengqing Zong",Bridging the Modality Gap for Speech-to-Text Translation,,,,,cs.CL,http://arxiv.org/licenses/nonexclusive-distrib/1.0/,"  End-to-end speech translation aims to translate speech in one language into
text in another language via an end-to-end way. Most existing methods employ an
encoder-decoder structure with a single encoder to learn acoustic
representation and semantic information simultaneously, which ignores the
speech-and-text modality differences and makes the encoder overloaded, leading
to great difficulty in learning such a model. To address these issues, we
propose a Speech-to-Text Adaptation for Speech Translation (STAST) model which
aims to improve the end-to-end model performance by bridging the modality gap
between speech and text. Specifically, we decouple the speech translation
encoder into three parts and introduce a shrink mechanism to match the length
of speech representation with that of the corresponding text transcription. To
obtain better semantic representation, we completely integrate a text-based
translation model into the STAST so that two tasks can be trained in the same
latent space. Furthermore, we introduce a cross-modal adaptation method to
close the distance between speech and text representation. Experimental results
on English-French and English-German speech translation corpora have shown that
our model significantly outperforms strong baselines, and achieves the new
state-of-the-art performance.
","[{'version': 'v1', 'created': 'Wed, 28 Oct 2020 12:33:04 GMT'}]",2020-10-29,"[['Liu', 'Yuchen', ''], ['Zhu', 'Junnan', ''], ['Zhang', 'Jiajun', ''], ['Zong', 'Chengqing', '']]"
1279293,2004.14523,Brian Thompson,Brian Thompson and Philipp Koehn,Exploiting Sentence Order in Document Alignment,EMNLP2020,,,,cs.CL,http://arxiv.org/licenses/nonexclusive-distrib/1.0/,"  We present a simple document alignment method that incorporates sentence
order information in both candidate generation and candidate re-scoring. Our
method results in 61% relative reduction in error compared to the best
previously published result on the WMT16 document alignment shared task. Our
method improves downstream MT performance on web-scraped Sinhala--English
documents from ParaCrawl, outperforming the document alignment method used in
the most recent ParaCrawl release. It also outperforms a comparable corpora
method which uses the same multilingual embeddings, demonstrating that
exploiting sentence order is beneficial even if the end goal is sentence-level
bitext.
","[{'version': 'v1', 'created': 'Thu, 30 Apr 2020 00:11:34 GMT'}, {'version': 'v2', 'created': 'Wed, 28 Oct 2020 01:23:22 GMT'}]",2020-10-29,"[['Thompson', 'Brian', ''], ['Koehn', 'Philipp', '']]"
1371355,2010.15025,Xingchen Song,"Xingchen Song, Zhiyong Wu, Yiheng Huang, Chao Weng, Dan Su, Helen Meng",Non-Autoregressive Transformer ASR with CTC-Enhanced Decoder Input,submitted to ICASSP 2021,,,,cs.SD cs.CL eess.AS,http://arxiv.org/licenses/nonexclusive-distrib/1.0/,"  Non-autoregressive (NAR) transformer models have achieved significantly
inference speedup but at the cost of inferior accuracy compared to
autoregressive (AR) models in automatic speech recognition (ASR). Most of the
NAR transformers take a fixed-length sequence filled with MASK tokens or a
redundant sequence copied from encoder states as decoder input, they cannot
provide efficient target-side information thus leading to accuracy degradation.
To address this problem, we propose a CTC-enhanced NAR transformer, which
generates target sequence by refining predictions of the CTC module.
Experimental results show that our method outperforms all previous NAR
counterparts and achieves 50x faster decoding speed than a strong AR baseline
with only 0.0 ~ 0.3 absolute CER degradation on Aishell-1 and Aishell-2
datasets.
","[{'version': 'v1', 'created': 'Wed, 28 Oct 2020 15:00:09 GMT'}]",2020-10-29,"[['Song', 'Xingchen', ''], ['Wu', 'Zhiyong', ''], ['Huang', 'Yiheng', ''], ['Weng', 'Chao', ''], ['Su', 'Dan', ''], ['Meng', 'Helen', '']]"
1371282,2010.14952,Isar Nejadgholi,Svetlana Kiritchenko and Isar Nejadgholi,Towards Ethics by Design in Online Abusive Content Detection,"14 pages, 2 figures",,,,cs.CL,http://arxiv.org/licenses/nonexclusive-distrib/1.0/,"  To support safety and inclusion in online communications, significant efforts
in NLP research have been put towards addressing the problem of abusive content
detection, commonly defined as a supervised classification task. The research
effort has spread out across several closely related sub-areas, such as
detection of hate speech, toxicity, cyberbullying, etc. There is a pressing
need to consolidate the field under a common framework for task formulation,
dataset design and performance evaluation. Further, despite current
technologies achieving high classification accuracies, several ethical issues
have been revealed. We bring ethical issues to forefront and propose a unified
framework as a two-step process. First, online content is categorized around
personal and identity-related subject matters. Second, severity of abuse is
identified through comparative annotation within each category. The novel
framework is guided by the Ethics by Design principle and is a step towards
building more accurate and trusted models.
","[{'version': 'v1', 'created': 'Wed, 28 Oct 2020 13:10:24 GMT'}]",2020-10-29,"[['Kiritchenko', 'Svetlana', ''], ['Nejadgholi', 'Isar', '']]"
1371444,2010.15114,Kyle Aitken,"Kyle Aitken, Vinay V. Ramasesh, Ankush Garg, Yuan Cao, David Sussillo,
  Niru Maheswaranathan",The geometry of integration in text classification RNNs,"9+19 pages, 30 figures",,,,cs.LG cs.CL stat.ML,http://arxiv.org/licenses/nonexclusive-distrib/1.0/,"  Despite the widespread application of recurrent neural networks (RNNs) across
a variety of tasks, a unified understanding of how RNNs solve these tasks
remains elusive. In particular, it is unclear what dynamical patterns arise in
trained RNNs, and how those patterns depend on the training dataset or task.
This work addresses these questions in the context of a specific natural
language processing task: text classification. Using tools from dynamical
systems analysis, we study recurrent networks trained on a battery of both
natural and synthetic text classification tasks. We find the dynamics of these
trained RNNs to be both interpretable and low-dimensional. Specifically, across
architectures and datasets, RNNs accumulate evidence for each class as they
process the text, using a low-dimensional attractor manifold as the underlying
mechanism. Moreover, the dimensionality and geometry of the attractor manifold
are determined by the structure of the training dataset; in particular, we
describe how simple word-count statistics computed on the training dataset can
be used to predict these properties. Our observations span multiple
architectures and datasets, reflecting a common mechanism RNNs employ to
perform text classification. To the degree that integration of evidence towards
a decision is a common computational primitive, this work lays the foundation
for using dynamical systems techniques to study the inner workings of RNNs.
","[{'version': 'v1', 'created': 'Wed, 28 Oct 2020 17:58:53 GMT'}]",2020-10-29,"[['Aitken', 'Kyle', ''], ['Ramasesh', 'Vinay V.', ''], ['Garg', 'Ankush', ''], ['Cao', 'Yuan', ''], ['Sussillo', 'David', ''], ['Maheswaranathan', 'Niru', '']]"
1371397,2010.15067,Muhammed Tarik Altuncu,"M. Tarik Altuncu, Sophia N. Yaliraki, Mauricio Barahona","Graph-based Topic Extraction from Vector Embeddings of Text Documents:
  Application to a Corpus of News Articles",,,,,cs.CL cs.AI cs.LG,http://arxiv.org/licenses/nonexclusive-distrib/1.0/,"  Production of news content is growing at an astonishing rate. To help manage
and monitor the sheer amount of text, there is an increasing need to develop
efficient methods that can provide insights into emerging content areas, and
stratify unstructured corpora of text into `topics' that stem intrinsically
from content similarity. Here we present an unsupervised framework that brings
together powerful vector embeddings from natural language processing with tools
from multiscale graph partitioning that can reveal natural partitions at
different resolutions without making a priori assumptions about the number of
clusters in the corpus. We show the advantages of graph-based clustering
through end-to-end comparisons with other popular clustering and topic
modelling methods, and also evaluate different text vector embeddings, from
classic Bag-of-Words to Doc2Vec to the recent transformers based model Bert.
This comparative work is showcased through an analysis of a corpus of US news
coverage during the presidential election year of 2016.
","[{'version': 'v1', 'created': 'Wed, 28 Oct 2020 16:20:05 GMT'}]",2020-10-29,"[['Altuncu', 'M. Tarik', ''], ['Yaliraki', 'Sophia N.', ''], ['Barahona', 'Mauricio', '']]"
1371420,2010.15090,Vishal Sunder,Vishal Sunder and Eric Fosler-Lussier,"Handling Class Imbalance in Low-Resource Dialogue Systems by Combining
  Few-Shot Classification and Interpolation","5 pages, 4 figures, 3 tables",,,,cs.CL cs.LG,http://arxiv.org/licenses/nonexclusive-distrib/1.0/,"  Utterance classification performance in low-resource dialogue systems is
constrained by an inevitably high degree of data imbalance in class labels. We
present a new end-to-end pairwise learning framework that is designed
specifically to tackle this phenomenon by inducing a few-shot classification
capability in the utterance representations and augmenting data through an
interpolation of utterance representations. Our approach is a general purpose
training methodology, agnostic to the neural architecture used for encoding
utterances. We show significant improvements in macro-F1 score over standard
cross-entropy training for three different neural architectures, demonstrating
improvements on a Virtual Patient dialogue dataset as well as a low-resourced
emulation of the Switchboard dialogue act classification dataset.
","[{'version': 'v1', 'created': 'Wed, 28 Oct 2020 17:05:24 GMT'}]",2020-10-29,"[['Sunder', 'Vishal', ''], ['Fosler-Lussier', 'Eric', '']]"
1371366,2010.15036,Usman Naseem,"Usman Naseem, Imran Razzak, Shah Khalid Khan, Mukesh Prasad","A Comprehensive Survey on Word Representation Models: From Classical to
  State-Of-The-Art Word Representation Language Models",,,,,cs.CL,http://creativecommons.org/licenses/by/4.0/,"  Word representation has always been an important research area in the history
of natural language processing (NLP). Understanding such complex text data is
imperative, given that it is rich in information and can be used widely across
various applications. In this survey, we explore different word representation
models and its power of expression, from the classical to modern-day
state-of-the-art word representation language models (LMS). We describe a
variety of text representation methods, and model designs have blossomed in the
context of NLP, including SOTA LMs. These models can transform large volumes of
text into effective vector representations capturing the same semantic
information. Further, such representations can be utilized by various machine
learning (ML) algorithms for a variety of NLP related tasks. In the end, this
survey briefly discusses the commonly used ML and DL based classifiers,
evaluation metrics and the applications of these word embeddings in different
NLP tasks.
","[{'version': 'v1', 'created': 'Wed, 28 Oct 2020 15:15:13 GMT'}]",2020-10-29,"[['Naseem', 'Usman', ''], ['Razzak', 'Imran', ''], ['Khan', 'Shah Khalid', ''], ['Prasad', 'Mukesh', '']]"
1371395,2010.15065,Amir Shanehsazzadeh,"Amir Shanehsazzadeh, David Belanger, David Dohan",Fixed-Length Protein Embeddings using Contextual Lenses,,,,,q-bio.BM cs.CL cs.LG,http://arxiv.org/licenses/nonexclusive-distrib/1.0/,"  The Basic Local Alignment Search Tool (BLAST) is currently the most popular
method for searching databases of biological sequences. BLAST compares
sequences via similarity defined by a weighted edit distance, which results in
it being computationally expensive. As opposed to working with edit distance, a
vector similarity approach can be accelerated substantially using modern
hardware or hashing techniques. Such an approach would require fixed-length
embeddings for biological sequences. There has been recent interest in learning
fixed-length protein embeddings using deep learning models under the hypothesis
that the hidden layers of supervised or semi-supervised models could produce
potentially useful vector embeddings. We consider transformer (BERT) protein
language models that are pretrained on the TrEMBL data set and learn
fixed-length embeddings on top of them with contextual lenses. The embeddings
are trained to predict the family a protein belongs to for sequences in the
Pfam database. We show that for nearest-neighbor family classification,
pretraining offers a noticeable boost in performance and that the corresponding
learned embeddings are competitive with BLAST. Furthermore, we show that the
raw transformer embeddings, obtained via static pooling, do not perform well on
nearest-neighbor family classification, which suggests that learning embeddings
in a supervised manner via contextual lenses may be a compute-efficient
alternative to fine-tuning.
","[{'version': 'v1', 'created': 'Thu, 15 Oct 2020 14:54:55 GMT'}]",2020-10-29,"[['Shanehsazzadeh', 'Amir', ''], ['Belanger', 'David', ''], ['Dohan', 'David', '']]"
1267866,2004.03096,Yiming Cui,"Nan Shao, Yiming Cui, Ting Liu, Shijin Wang, Guoping Hu",Is Graph Structure Necessary for Multi-hop Question Answering?,"6 pages, to appear at EMNLP 2020",,,,cs.CL,http://arxiv.org/licenses/nonexclusive-distrib/1.0/,"  Recently, attempting to model texts as graph structure and introducing graph
neural networks to deal with it has become a trend in many NLP research areas.
In this paper, we investigate whether the graph structure is necessary for
multi-hop question answering. Our analysis is centered on HotpotQA. We
construct a strong baseline model to establish that, with the proper use of
pre-trained models, graph structure may not be necessary for multi-hop question
answering. We point out that both graph structure and adjacency matrix are
task-related prior knowledge, and graph-attention can be considered as a
special case of self-attention. Experiments and visualized analysis demonstrate
that graph-attention or the entire graph structure can be replaced by
self-attention or Transformers.
","[{'version': 'v1', 'created': 'Tue, 7 Apr 2020 02:59:42 GMT'}, {'version': 'v2', 'created': 'Thu, 29 Oct 2020 09:29:19 GMT'}]",2020-10-30,"[['Shao', 'Nan', ''], ['Cui', 'Yiming', ''], ['Liu', 'Ting', ''], ['Wang', 'Shijin', ''], ['Hu', 'Guoping', '']]"
