,id,submitter,authors,title,comments,journal-ref,doi,report-no,categories,license,abstract,versions,update_date,authors_parsed
1370156,2010.13826,Cheng-I Lai,"Cheng-I Lai, Yung-Sung Chuang, Hung-Yi Lee, Shang-Wen Li, James Glass","Semi-Supervised Spoken Language Understanding via Self-Supervised Speech
  and Language Model Pretraining",,,,,cs.CL,http://arxiv.org/licenses/nonexclusive-distrib/1.0/,"  Much recent work on Spoken Language Understanding (SLU) is limited in at
least one of three ways: models were trained on oracle text input and neglected
ASR errors, models were trained to predict only intents without the slot
values, or models were trained on a large amount of in-house data. In this
paper, we propose a clean and general framework to learn semantics directly
from speech with semi-supervision from transcribed or untranscribed speech to
address these issues. Our framework is built upon pretrained end-to-end (E2E)
ASR and self-supervised language models, such as BERT, and fine-tuned on a
limited amount of target SLU data. We study two semi-supervised settings for
the ASR component: supervised pretraining on transcribed speech, and
unsupervised pretraining by replacing the ASR encoder with self-supervised
speech representations, such as wav2vec. In parallel, we identify two essential
criteria for evaluating SLU models: environmental noise-robustness and E2E
semantics evaluation. Experiments on ATIS show that our SLU framework with
speech as input can perform on par with those using oracle text as input in
semantics understanding, even though environmental noise is present and a
limited amount of labeled semantics data is available for training.
","[{'version': 'v1', 'created': 'Mon, 26 Oct 2020 18:21:27 GMT'}]",2020-10-28,"[['Lai', 'Cheng-I', ''], ['Chuang', 'Yung-Sung', ''], ['Lee', 'Hung-Yi', ''], ['Li', 'Shang-Wen', ''], ['Glass', 'James', '']]"
1370432,2010.14102,Wen Wu,"Wen Wu, Chao Zhang, Philip C. Woodland","Emotion recognition by fusing time synchronous and time asynchronous
  representations",,,,,cs.CL cs.LG cs.SD eess.AS,http://arxiv.org/licenses/nonexclusive-distrib/1.0/,"  In this paper, a novel two-branch neural network model structure is proposed
for multimodal emotion recognition, which consists of a time synchronous branch
(TSB) and a time asynchronous branch (TAB). To capture correlations between
each word and its acoustic realisation, the TSB combines speech and text
modalities at each input window frame and then does pooling across time to form
a single embedding vector. The TAB, by contrast, provides cross-utterance
information by integrating sentence text embeddings from a number of context
utterances into another embedding vector. The final emotion classification uses
both the TSB and the TAB embeddings. Experimental results on the IEMOCAP
dataset demonstrate that the two-branch structure achieves state-of-the-art
results in 4-way classification with all common test setups. When using
automatic speech recognition (ASR) output instead of manually transcribed
reference text, it is shown that the cross-utterance information considerably
improves the robustness against ASR errors. Furthermore, by incorporating an
extra class for all the other emotions, the final 5-way classification system
with ASR hypotheses can be viewed as a prototype for more realistic emotion
recognition systems.
","[{'version': 'v1', 'created': 'Tue, 27 Oct 2020 07:14:31 GMT'}]",2020-10-28,"[['Wu', 'Wen', ''], ['Zhang', 'Chao', ''], ['Woodland', 'Philip C.', '']]"
1370391,2010.14061,Yan Zeng,Yan Zeng and Jian-Yun Nie,"Multi-Domain Dialogue State Tracking -- A Purely Transformer-Based
  Generative Approach","[v0], 8 pages, 3 figures. arXiv admin note: text overlap with
  arXiv:2010.11137",,,,cs.CL cs.AI,http://arxiv.org/licenses/nonexclusive-distrib/1.0/,"  We investigate the problem of multi-domain Dialogue State Tracking (DST) with
open vocabulary. Existing approaches exploit BERT encoder and copy-based RNN
decoder, where the encoder first predicts the state operation, and then the
decoder generates new slot values. However, in this stacked encoder-decoder
structure, the operation prediction objective only affects the BERT encoder and
the value generation objective mainly affects the RNN decoder. In this paper,
we propose a purely Transformer-based framework that uses BERT as both encoder
and decoder. In so doing, the operation prediction objective and the value
generation objective can jointly optimize our model for DST. At the decoding
step, we re-use the hidden states of the encoder in the self-attention
mechanism of the corresponding decoder layer to construct a flat model
structure for effective parameter updating. Experimental results show that our
approach substantially outperforms the existing state-of-the-art framework, and
it also achieves very competitive performance to the best ontology-based
approaches.
","[{'version': 'v1', 'created': 'Sat, 24 Oct 2020 04:54:52 GMT'}]",2020-10-28,"[['Zeng', 'Yan', ''], ['Nie', 'Jian-Yun', '']]"
1370372,2010.14042,Kasturi Bhattacharjee,"Kasturi Bhattacharjee, Miguel Ballesteros, Rishita Anubhai, Smaranda
  Muresan, Jie Ma, Faisal Ladhak, Yaser Al-Onaizan","To BERT or Not to BERT: Comparing Task-specific and Task-agnostic
  Semi-Supervised Approaches for Sequence Tagging","Accepted in the Proceedings of 2020 Conference on Empirical Methods
  in Natural Language Processing (EMNLP
  2020)(https://2020.emnlp.org/papers/main)",,,,cs.CL,http://arxiv.org/licenses/nonexclusive-distrib/1.0/,"  Leveraging large amounts of unlabeled data using Transformer-like
architectures, like BERT, has gained popularity in recent times owing to their
effectiveness in learning general representations that can then be further
fine-tuned for downstream tasks to much success. However, training these models
can be costly both from an economic and environmental standpoint. In this work,
we investigate how to effectively use unlabeled data: by exploring the
task-specific semi-supervised approach, Cross-View Training (CVT) and comparing
it with task-agnostic BERT in multiple settings that include domain and task
relevant English data. CVT uses a much lighter model architecture and we show
that it achieves similar performance to BERT on a set of sequence tagging
tasks, with lesser financial and environmental impact.
","[{'version': 'v1', 'created': 'Tue, 27 Oct 2020 04:03:47 GMT'}]",2020-10-28,"[['Bhattacharjee', 'Kasturi', ''], ['Ballesteros', 'Miguel', ''], ['Anubhai', 'Rishita', ''], ['Muresan', 'Smaranda', ''], ['Ma', 'Jie', ''], ['Ladhak', 'Faisal', ''], ['Al-Onaizan', 'Yaser', '']]"
1370359,2010.14029,Runxin Xu,"Runxin Xu, Zhuo Zhi, Jun Cao, Mingxuan Wang, Lei Li",Volctrans Parallel Corpus Filtering System for WMT 2020,WMT 2020,,,,cs.CL,http://arxiv.org/licenses/nonexclusive-distrib/1.0/,"  In this paper, we describe our submissions to the WMT20 shared task on
parallel corpus filtering and alignment for low-resource conditions. The task
requires the participants to align potential parallel sentence pairs out of the
given document pairs, and score them so that low-quality pairs can be filtered.
Our system, Volctrans, is made of two modules, i.e., a mining module and a
scoring module. Based on the word alignment model, the mining module adopts an
iterative mining strategy to extract latent parallel sentences. In the scoring
module, an XLM-based scorer provides scores, followed by reranking mechanisms
and ensemble. Our submissions outperform the baseline by 3.x/2.x and 2.x/2.x
for km-en and ps-en on From Scratch/Fine-Tune conditions, which is the highest
among all submissions.
","[{'version': 'v1', 'created': 'Tue, 27 Oct 2020 03:20:04 GMT'}]",2020-10-28,"[['Xu', 'Runxin', ''], ['Zhi', 'Zhuo', ''], ['Cao', 'Jun', ''], ['Wang', 'Mingxuan', ''], ['Li', 'Lei', '']]"
1370321,2010.13991,Wei Zou,"Dongwei Jiang, Wubo Li, Miao Cao, Ruixiong Zhang, Wei Zou, Kun Han,
  Xiangang Li","Speech SIMCLR: Combining Contrastive and Reconstruction Objective for
  Self-supervised Speech Representation Learning",,,,,cs.CL,http://arxiv.org/licenses/nonexclusive-distrib/1.0/,"  Self-supervised visual pretraining has shown significant progress recently.
Among those methods, SimCLR greatly advanced the state of the art in
self-supervised and semi-supervised learning on ImageNet. The input feature
representations for speech and visual tasks are both continuous, so it is
natural to consider applying similar objective on speech representation
learning. In this paper, we propose Speech SimCLR, a new self-supervised
objective for speech representation learning. During training, Speech SimCLR
applies augmentation on raw speech and its spectrogram. Its objective is the
combination of contrastive loss that maximizes agreement between differently
augmented samples in the latent space and reconstruction loss of input
representation. The proposed method achieved competitive results on speech
emotion recognition and speech recognition. When used as feature extractor, our
best model achieved 5.89% word error rate on LibriSpeech test-clean set using
LibriSpeech 960 hours as pretraining data and LibriSpeech train-clean-100 set
as fine-tuning data, which is the lowest error rate obtained in this setup to
the best of our knowledge.
","[{'version': 'v1', 'created': 'Tue, 27 Oct 2020 02:09:06 GMT'}]",2020-10-28,"[['Jiang', 'Dongwei', ''], ['Li', 'Wubo', ''], ['Cao', 'Miao', ''], ['Zhang', 'Ruixiong', ''], ['Zou', 'Wei', ''], ['Han', 'Kun', ''], ['Li', 'Xiangang', '']]"
1339591,2008.11869,Xinsong Zhang,Xinsong Zhang and Hang Li,AMBERT: A Pre-trained Language Model with Multi-Grained Tokenization,,,,,cs.CL cs.LG,http://arxiv.org/licenses/nonexclusive-distrib/1.0/,"  Pre-trained language models such as BERT have exhibited remarkable
performances in many tasks in natural language understanding (NLU). The tokens
in the models are usually fine-grained in the sense that for languages like
English they are words or sub-words and for languages like Chinese they are
characters. In English, for example, there are multi-word expressions which
form natural lexical units and thus the use of coarse-grained tokenization also
appears to be reasonable. In fact, both fine-grained and coarse-grained
tokenizations have advantages and disadvantages for learning of pre-trained
language models. In this paper, we propose a novel pre-trained language model,
referred to as AMBERT (A Multi-grained BERT), on the basis of both fine-grained
and coarse-grained tokenizations. For English, AMBERT takes both the sequence
of words (fine-grained tokens) and the sequence of phrases (coarse-grained
tokens) as input after tokenization, employs one encoder for processing the
sequence of words and the other encoder for processing the sequence of the
phrases, utilizes shared parameters between the two encoders, and finally
creates a sequence of contextualized representations of the words and a
sequence of contextualized representations of the phrases. Experiments have
been conducted on benchmark datasets for Chinese and English, including CLUE,
GLUE, SQuAD and RACE. The results show that AMBERT outperforms the existing
best performing models in almost all cases, particularly the improvements are
significant for Chinese.
","[{'version': 'v1', 'created': 'Thu, 27 Aug 2020 00:23:48 GMT'}, {'version': 'v2', 'created': 'Tue, 1 Sep 2020 05:29:27 GMT'}, {'version': 'v3', 'created': 'Tue, 27 Oct 2020 06:53:33 GMT'}]",2020-10-28,"[['Zhang', 'Xinsong', ''], ['Li', 'Hang', '']]"
1279334,2004.14564,Brian Thompson,Brian Thompson and Matt Post,"Automatic Machine Translation Evaluation in Many Languages via Zero-Shot
  Paraphrasing",EMNLP2020,,,,cs.CL,http://arxiv.org/licenses/nonexclusive-distrib/1.0/,"  We frame the task of machine translation evaluation as one of scoring machine
translation output with a sequence-to-sequence paraphraser, conditioned on a
human reference. We propose training the paraphraser as a multilingual NMT
system, treating paraphrasing as a zero-shot translation task (e.g., Czech to
Czech). This results in the paraphraser's output mode being centered around a
copy of the input sequence, which represents the best case scenario where the
MT system output matches a human reference. Our method is simple and intuitive,
and does not require human judgements for training. Our single model (trained
in 39 languages) outperforms or statistically ties with all prior metrics on
the WMT 2019 segment-level shared metrics task in all languages (excluding
Gujarati where the model had no training data). We also explore using our model
for the task of quality estimation as a metric--conditioning on the source
instead of the reference--and find that it significantly outperforms every
submission to the WMT 2019 shared task on quality estimation in every language
pair.
","[{'version': 'v1', 'created': 'Thu, 30 Apr 2020 03:32:34 GMT'}, {'version': 'v2', 'created': 'Tue, 27 Oct 2020 23:54:02 GMT'}]",2020-10-29,"[['Thompson', 'Brian', ''], ['Post', 'Matt', '']]"
1187463,1910.03544,Jianguo Zhang,"Jian-Guo Zhang, Kazuma Hashimoto, Chien-Sheng Wu, Yao Wan, Philip S.
  Yu, Richard Socher, Caiming Xiong","Find or Classify? Dual Strategy for Slot-Value Predictions on
  Multi-Domain Dialog State Tracking","14 pages, accepted at the 9th Joint Conference on Lexical and
  Computational Semantics (*SEM 2020). This version fixes small errors",,,,cs.CL cs.AI,http://arxiv.org/licenses/nonexclusive-distrib/1.0/,"  Dialog state tracking (DST) is a core component in task-oriented dialog
systems. Existing approaches for DST mainly fall into one of two categories,
namely, ontology-based and ontology-free methods. An ontology-based method
selects a value from a candidate-value list for each target slot, while an
ontology-free method extracts spans from dialog contexts. Recent work
introduced a BERT-based model to strike a balance between the two methods by
pre-defining categorical and non-categorical slots. However, it is not clear
enough which slots are better handled by either of the two slot types, and the
way to use the pre-trained model has not been well investigated. In this paper,
we propose a simple yet effective dual-strategy model for DST, by adapting a
single BERT-style reading comprehension model to jointly handle both the
categorical and non-categorical slots. Our experiments on the MultiWOZ datasets
show that our method significantly outperforms the BERT-based counterpart,
finding that the key is a deep interaction between the domain-slot and context
information. When evaluated on noisy (MultiWOZ 2.0) and cleaner (MultiWOZ 2.1)
settings, our method performs competitively and robustly across the two
different settings. Our method sets the new state of the art in the noisy
setting, while performing more robustly than the best model in the cleaner
setting. We also conduct a comprehensive error analysis on the dataset,
including the effects of the dual strategy for each slot, to facilitate future
research.
","[{'version': 'v1', 'created': 'Tue, 8 Oct 2019 17:08:39 GMT'}, {'version': 'v2', 'created': 'Thu, 10 Oct 2019 08:04:12 GMT'}, {'version': 'v3', 'created': 'Tue, 29 Sep 2020 08:37:44 GMT'}, {'version': 'v4', 'created': 'Wed, 28 Oct 2020 10:07:01 GMT'}]",2020-10-29,"[['Zhang', 'Jian-Guo', ''], ['Hashimoto', 'Kazuma', ''], ['Wu', 'Chien-Sheng', ''], ['Wan', 'Yao', ''], ['Yu', 'Philip S.', ''], ['Socher', 'Richard', ''], ['Xiong', 'Caiming', '']]"
1342828,2009.01325,Ryan Lowe T.,"Nisan Stiennon, Long Ouyang, Jeff Wu, Daniel M. Ziegler, Ryan Lowe,
  Chelsea Voss, Alec Radford, Dario Amodei, Paul Christiano",Learning to summarize from human feedback,NeurIPS 2020 camera ready,,,,cs.CL cs.AI cs.LG,http://arxiv.org/licenses/nonexclusive-distrib/1.0/,"  As language models become more powerful, training and evaluation are
increasingly bottlenecked by the data and metrics used for a particular task.
For example, summarization models are often trained to predict human reference
summaries and evaluated using ROUGE, but both of these metrics are rough
proxies for what we really care about---summary quality. In this work, we show
that it is possible to significantly improve summary quality by training a
model to optimize for human preferences. We collect a large, high-quality
dataset of human comparisons between summaries, train a model to predict the
human-preferred summary, and use that model as a reward function to fine-tune a
summarization policy using reinforcement learning. We apply our method to a
version of the TL;DR dataset of Reddit posts and find that our models
significantly outperform both human reference summaries and much larger models
fine-tuned with supervised learning alone. Our models also transfer to CNN/DM
news articles, producing summaries nearly as good as the human reference
without any news-specific fine-tuning. We conduct extensive analyses to
understand our human feedback dataset and fine-tuned models We establish that
our reward model generalizes to new datasets, and that optimizing our reward
model results in better summaries than optimizing ROUGE according to humans. We
hope the evidence from our paper motivates machine learning researchers to pay
closer attention to how their training loss affects the model behavior they
actually want.
","[{'version': 'v1', 'created': 'Wed, 2 Sep 2020 19:54:41 GMT'}, {'version': 'v2', 'created': 'Tue, 27 Oct 2020 22:19:53 GMT'}]",2020-10-29,"[['Stiennon', 'Nisan', ''], ['Ouyang', 'Long', ''], ['Wu', 'Jeff', ''], ['Ziegler', 'Daniel M.', ''], ['Lowe', 'Ryan', ''], ['Voss', 'Chelsea', ''], ['Radford', 'Alec', ''], ['Amodei', 'Dario', ''], ['Christiano', 'Paul', '']]"
1201327,1911.02733,Xue Mengge,"Xue Mengge, Yu Bowen, Liu Tingwen, Zhang Yue, Meng Erli, Wang Bin",Porous Lattice-based Transformer Encoder for Chinese NER,"9 pages, 4 figures",COLING 2020,,,cs.CL cs.IR,http://arxiv.org/licenses/nonexclusive-distrib/1.0/,"  Incorporating lattices into character-level Chinese named entity recognition
is an effective method to exploit explicit word information. Recent works
extend recurrent and convolutional neural networks to model lattice inputs.
However, due to the DAG structure or the variable-sized potential word set for
lattice inputs, these models prevent the convenient use of batched computation,
resulting in serious inefficient. In this paper, we propose a porous
lattice-based transformer encoder for Chinese named entity recognition, which
is capable to better exploit the GPU parallelism and batch the computation
owing to the mask mechanism in transformer. We first investigate the
lattice-aware self-attention coupled with relative position representations to
explore effective word information in the lattice structure. Besides, to
strengthen the local dependencies among neighboring tokens, we propose a novel
porous structure during self-attentional computation processing, in which every
two non-neighboring tokens are connected through a shared pivot node.
Experimental results on four datasets show that our model performs up to 9.47
times faster than state-of-the-art models, while is roughly on a par with its
performance. The source code of this paper can be obtained from
https://github.com/xxx/xxx.
","[{'version': 'v1', 'created': 'Thu, 7 Nov 2019 02:58:17 GMT'}, {'version': 'v2', 'created': 'Fri, 24 Apr 2020 14:46:51 GMT'}, {'version': 'v3', 'created': 'Wed, 28 Oct 2020 12:52:24 GMT'}]",2020-10-29,"[['Mengge', 'Xue', ''], ['Bowen', 'Yu', ''], ['Tingwen', 'Liu', ''], ['Yue', 'Zhang', ''], ['Erli', 'Meng', ''], ['Bin', 'Wang', '']]"
1290078,2005.10283,Bryan Eikema,Bryan Eikema and Wilker Aziz,"Is MAP Decoding All You Need? The Inadequacy of the Mode in Neural
  Machine Translation",COLING 2020 camera-ready,,,,cs.CL,http://creativecommons.org/licenses/by/4.0/,"  Recent studies have revealed a number of pathologies of neural machine
translation (NMT) systems. Hypotheses explaining these mostly suggest there is
something fundamentally wrong with NMT as a model or its training algorithm,
maximum likelihood estimation (MLE). Most of this evidence was gathered using
maximum a posteriori (MAP) decoding, a decision rule aimed at identifying the
highest-scoring translation, i.e. the mode. We argue that the evidence
corroborates the inadequacy of MAP decoding more than casts doubt on the model
and its training algorithm. In this work, we show that translation
distributions do reproduce various statistics of the data well, but that beam
search strays from such statistics. We show that some of the known pathologies
and biases of NMT are due to MAP decoding and not to NMT's statistical
assumptions nor MLE. In particular, we show that the most likely translations
under the model accumulate so little probability mass that the mode can be
considered essentially arbitrary. We therefore advocate for the use of decision
rules that take into account the translation distribution holistically. We show
that an approximation to minimum Bayes risk decoding gives competitive results
confirming that NMT models do capture important aspects of translation well in
expectation.
","[{'version': 'v1', 'created': 'Wed, 20 May 2020 18:05:51 GMT'}, {'version': 'v2', 'created': 'Wed, 28 Oct 2020 11:29:52 GMT'}]",2020-10-29,"[['Eikema', 'Bryan', ''], ['Aziz', 'Wilker', '']]"
1303020,2006.08506,Tobias Watzel,"Tobias Watzel, Ludwig K\""urzinger, Lujun Li, Gerhard Rigoll",Regularized Forward-Backward Decoder for Attention Models,,,,,eess.AS cs.CL,http://arxiv.org/licenses/nonexclusive-distrib/1.0/,"  Nowadays, attention models are one of the popular candidates for speech
recognition. So far, many studies mainly focus on the encoder structure or the
attention module to enhance the performance of these models. However, mostly
ignore the decoder. In this paper, we propose a novel regularization technique
incorporating a second decoder during the training phase. This decoder is
optimized on time-reversed target labels beforehand and supports the standard
decoder during training by adding knowledge from future context. Since it is
only added during training, we are not changing the basic structure of the
network or adding complexity during decoding. We evaluate our approach on the
smaller TEDLIUMv2 and the larger LibriSpeech dataset, achieving consistent
improvements on both of them.
","[{'version': 'v1', 'created': 'Mon, 15 Jun 2020 16:04:16 GMT'}, {'version': 'v2', 'created': 'Wed, 28 Oct 2020 14:00:52 GMT'}]",2020-10-29,"[['Watzel', 'Tobias', ''], ['Kürzinger', 'Ludwig', ''], ['Li', 'Lujun', ''], ['Rigoll', 'Gerhard', '']]"
1295146,2006.00632,Barbara Plank,Alan Ramponi and Barbara Plank,Neural Unsupervised Domain Adaptation in NLP---A Survey,"COLING 2020. Accompanying repository:
  https://github.com/bplank/awesome-neural-adaptation-in-NLP",,,,cs.CL,http://arxiv.org/licenses/nonexclusive-distrib/1.0/,"  Deep neural networks excel at learning from labeled data and achieve
state-of-the-art resultson a wide array of Natural Language Processing tasks.
In contrast, learning from unlabeled data, especially under domain shift,
remains a challenge. Motivated by the latest advances, in this survey we review
neural unsupervised domain adaptation techniques which do not require labeled
target domain data. This is a more challenging yet a more widely applicable
setup. We outline methods, from early traditional non-neural methods to
pre-trained model transfer. We also revisit the notion of domain, and we
uncover a bias in the type of Natural Language Processing tasks which received
most attention. Lastly, we outline future directions, particularly the broader
need for out-of-distribution generalization of future NLP.
","[{'version': 'v1', 'created': 'Sun, 31 May 2020 22:34:14 GMT'}, {'version': 'v2', 'created': 'Wed, 28 Oct 2020 08:24:14 GMT'}]",2020-10-29,"[['Ramponi', 'Alan', ''], ['Plank', 'Barbara', '']]"
1292163,2005.12368,Marija Stepanovi\'c,"Andreas Kirkedal, Marija Stepanovi\'c, Barbara Plank",FT Speech: Danish Parliament Speech Corpus,Accepted at Interspeech 2020,,10.21437/Interspeech.2020-3164,,cs.CL cs.LG cs.SD eess.AS,http://arxiv.org/licenses/nonexclusive-distrib/1.0/,"  This paper introduces FT Speech, a new speech corpus created from the
recorded meetings of the Danish Parliament, otherwise known as the Folketing
(FT). The corpus contains over 1,800 hours of transcribed speech by a total of
434 speakers. It is significantly larger in duration, vocabulary, and amount of
spontaneous speech than the existing public speech corpora for Danish, which
are largely limited to read-aloud and dictation data. We outline design
considerations, including the preprocessing methods and the alignment
procedure. To evaluate the quality of the corpus, we train automatic speech
recognition systems on the new resource and compare them to the systems trained
on the Danish part of Spr\r{a}kbanken, the largest public ASR corpus for Danish
to date. Our baseline results show that we achieve a 14.01 WER on the new
corpus. A combination of FT Speech with in-domain language data provides
comparable results to models trained specifically on Spr\r{a}kbanken, showing
that FT Speech transfers well to this data set. Interestingly, our results
demonstrate that the opposite is not the case. This shows that FT Speech
provides a valuable resource for promoting research on Danish ASR with more
spontaneous speech.
","[{'version': 'v1', 'created': 'Mon, 25 May 2020 19:51:18 GMT'}, {'version': 'v2', 'created': 'Wed, 28 Oct 2020 13:36:44 GMT'}]",2020-10-29,"[['Kirkedal', 'Andreas', ''], ['Stepanović', 'Marija', ''], ['Plank', 'Barbara', '']]"
